<user xmlns:xsi="http://www.w3.org/2001/XMLSchema-instance" xsi:noNamespaceSchemaLocation="user.xsd">
	<OSU_Email_ID>pande.1@osu.edu</OSU_Email_ID>
	<firstName>Chulbul</firstName>
	<lastName>Pande</lastName>
	<phoneNumber>1234567890</phoneNumber>
	<dob>1970-04-04</dob>
	<isFaculty>0</isFaculty>
	<userName>pandeji007</userName>
	<password>1234temp</password>
	<aboutMe>nonthing special</aboutMe>
	<major>CS@!</major>
	<interests>Dancing</interests>
	<privacySettings text="0" call="1" view="1" />
</user>
